{
  "schema_version": "decision-view.v1",
  "snapshot_sha256": "aaaaaaaaaaaaaaaaaaaaaaaaaaaaaaaaaaaaaaaaaaaaaaaaaaaaaaaaaaaaaaaa",
  "generated_at": "2026-08-11T03:00:00Z",
  "include_cited_excerpts": false,
  "status": {
    "lifecycle_state": "approved",
    "verified": true,
    "decision_complete": true,
    "ready": true,
    "stale_reasons": []
  },
  "artifacts": {
    "decision_frame": {
      "schema_version": "2.0",
      "artifact_type": "decision-frame",
      "session_id": "support-triage",
      "producer": {
        "kind": "fixture"
      },
      "parents": {},
      "payload": {
        "business_user": "고객지원 운영 책임자",
        "blocked_decision": "문의 분류 방식을 결정하지 못함",
        "problem_statement": "감사 가능성과 개인정보 보호를 지키며 문의를 분류한다."
      }
    },
    "candidate_set": {
      "schema_version": "2.0",
      "artifact_type": "candidate-set",
      "session_id": "support-triage",
      "producer": {
        "kind": "fixture"
      },
      "parents": {},
      "payload": {
        "candidates": [
          {
            "candidate_id": "rules",
            "title": "규칙 기반",
            "summary": "명시적인 분류 규칙을 운영하고 변경 내역을 직접 감사한다."
          },
          {
            "candidate_id": "classical-ml",
            "title": "전통 ML",
            "summary": "로컬 분류 모델과 인간 검토 큐를 함께 사용한다."
          },
          {
            "candidate_id": "llm-assisted",
            "title": "LLM 보조",
            "summary": "모델 초안과 인간 검토를 결합한다."
          }
        ]
      }
    },
    "criteria_set": {
      "schema_version": "2.0",
      "artifact_type": "criteria-set",
      "session_id": "support-triage",
      "producer": {
        "kind": "fixture"
      },
      "parents": {},
      "payload": {
        "criteria": [
          {
            "criterion_id": "privacy",
            "title": "개인정보 보호",
            "definition": "승인되지 않은 외부 시스템으로 문의 원문을 보내지 않는다.",
            "priority": "must"
          },
          {
            "criterion_id": "auditability",
            "title": "감사 가능성",
            "definition": "결정 근거와 변경 이력을 사람이 재검토할 수 있다.",
            "priority": "must"
          },
          {
            "criterion_id": "quality",
            "title": "분류 품질",
            "definition": "합성 검증셋의 오류 유형을 추적하고 개선할 수 있다.",
            "priority": "high"
          }
        ]
      }
    },
    "evidence_set": {
      "schema_version": "2.0",
      "artifact_type": "evidence-set",
      "session_id": "support-triage",
      "producer": {
        "kind": "fixture"
      },
      "parents": {},
      "payload": {
        "evidence": [
          {
            "evidence_id": "ev-local-run",
            "claim": "규칙 및 전통 ML 후보는 로컬 환경에서 문의를 처리한다.",
            "provenance": "source_observation",
            "source": {
              "source_id": "synthetic-ops-note",
              "start_line": 2,
              "end_line": 4,
              "excerpt_sha256": "bbbbbbbbbbbbbbbbbbbbbbbbbbbbbbbbbbbbbbbbbbbbbbbbbbbbbbbbbbbbbbbb"
            }
          },
          {
            "evidence_id": "ev-change-log",
            "claim": "규칙 변경 기록에는 작성자와 검토 사유가 포함된다.",
            "provenance": "source_observation",
            "source": {
              "source_id": "synthetic-change-log",
              "start_line": 7,
              "end_line": 9,
              "excerpt_sha256": "cccccccccccccccccccccccccccccccccccccccccccccccccccccccccccccccc"
            }
          }
        ]
      }
    },
    "evaluation_set": {
      "schema_version": "2.0",
      "artifact_type": "evaluation-set",
      "session_id": "support-triage",
      "producer": {
        "kind": "fixture"
      },
      "parents": {},
      "payload": {
        "cells": [
          {
            "candidate_id": "rules",
            "criterion_id": "privacy",
            "assessment": "meets",
            "rationale": "로컬 실행 근거가 있다.",
            "evidence_ids": [
              "ev-local-run"
            ]
          },
          {
            "candidate_id": "rules",
            "criterion_id": "auditability",
            "assessment": "meets",
            "rationale": "변경 기록을 직접 감사할 수 있다.",
            "evidence_ids": [
              "ev-change-log"
            ]
          },
          {
            "candidate_id": "rules",
            "criterion_id": "quality",
            "assessment": "partial",
            "rationale": "규칙 누락을 정기 검토해야 한다.",
            "evidence_ids": [
              "ev-change-log"
            ]
          },
          {
            "candidate_id": "classical-ml",
            "criterion_id": "privacy",
            "assessment": "meets",
            "rationale": "모델이 로컬에서 실행된다.",
            "evidence_ids": [
              "ev-local-run"
            ]
          },
          {
            "candidate_id": "classical-ml",
            "criterion_id": "auditability",
            "assessment": "partial",
            "rationale": "오류 분석 기록이 추가로 필요하다.",
            "evidence_ids": [
              "ev-change-log"
            ]
          },
          {
            "candidate_id": "classical-ml",
            "criterion_id": "quality",
            "assessment": "meets",
            "rationale": "검증셋으로 오류 유형을 추적한다.",
            "evidence_ids": [
              "ev-local-run"
            ]
          },
          {
            "candidate_id": "llm-assisted",
            "criterion_id": "privacy",
            "assessment": "fails",
            "rationale": "외부 전송 동의 근거가 없다.",
            "evidence_ids": [
              "ev-local-run"
            ]
          },
          {
            "candidate_id": "llm-assisted",
            "criterion_id": "auditability",
            "assessment": "partial",
            "rationale": "모델 설명은 인간 검토가 필요하다.",
            "evidence_ids": [
              "ev-change-log"
            ]
          },
          {
            "candidate_id": "llm-assisted",
            "criterion_id": "quality",
            "assessment": "insufficient_evidence",
            "rationale": "실측 근거가 없다.",
            "evidence_ids": []
          }
        ]
      }
    },
    "comparison": {
      "schema_version": "2.0",
      "artifact_type": "comparison",
      "session_id": "support-triage",
      "producer": {
        "kind": "fixture"
      },
      "parents": {},
      "payload": {
        "eligible_candidate_ids": [
          "rules",
          "classical-ml"
        ],
        "ineligible_candidate_ids": [
          "llm-assisted"
        ]
      }
    },
    "recommendation": {
      "schema_version": "2.0",
      "artifact_type": "recommendation",
      "session_id": "support-triage",
      "producer": {
        "kind": "fixture"
      },
      "parents": {},
      "payload": {
        "disposition": "select",
        "candidate_id": "classical-ml",
        "rationale": "합성 평가에서는 분류 품질 근거가 더 충분하다."
      }
    },
    "final_decision": {
      "schema_version": "2.0",
      "artifact_type": "final-decision",
      "session_id": "support-triage",
      "producer": {
        "kind": "fixture"
      },
      "parents": {},
      "payload": {
        "disposition": "select",
        "candidate_id": "rules",
        "reason": "현재 팀은 규칙 변경을 직접 감사하는 방식을 우선한다.",
        "recommendation_relation": "different",
        "risk_acknowledgements": [
          "분류 품질은 정기적으로 재검증한다."
        ]
      }
    }
  },
  "digest_map": {
    "decision_frame": "904fb9c874ddbe15c0af51221e475187fecc772101e22b3061a6dedc28790264",
    "candidate_set": "59f71d852c6bf844990a02f6642264069cfaa3ebde5793c83bd450735b30242f",
    "criteria_set": "b431ebc0f853cf2aacd1023373d948f170db79fcb586e91432c3c34817f01400",
    "evidence_set": "70a46644c2c220442387829c2e23d7db914c7703d8a65826a6f3327748c08c30",
    "evaluation_set": "2f2d4fb5c803589c52cde7a9757621c55133c7e96b3f6fca0207c52b03f0dc92",
    "comparison": "0f41dc8371c448beeb0d1955b1d0e4f7f083a6b59c0e9effd2629bb5fc3bf329",
    "recommendation": "15cb3a22b7016adde7d4146ff42244bf8d95ea22eab428c7eb5a1df10de27f30",
    "final_decision": "6d1e40cc4b708c606ac63be6638360f262e0e9310f5885b4421c4a353e4f10da"
  },
  "cited_excerpts": {},
  "integrity_sha256": "4a3542aa4867c88eea73ee9bbac989e144e99e11637556f6be55d2d0feb02b1a"
}
